"code","description","domain","grade","keywords","prerequisite","scope","level_A","level_B","level_C","level_D","level_E","competencies","common_misconceptions"
"[9국04-01]","국어의 음운 체계와 문자 체계를 이해하고 국어생활에 활용한다.","문법","중학교","","","","국어의 음운 체계와 문자 체계를 탐구하고 국어생활의 발음과 표기에 체계적이며 적절하게 활용할 수 있다.","국어의 음운 체계와 문자 체계를 분석하고 국어생활의 발음과 표기에 적절하게 활용할 수 있다.","국어의 음운 체계와 문자 체계를 이해하고 국어생활의 발음과 표기에 활용할 수 있다.","국어의 음운 체계와 문자 체계를 일부 이해하고 국어생활의 발음과 표기에 부분적으로 활용할 수 있다.","국어의 음운 체계와 문자 체계를 확인하고 국어생활의 발음과 표기에 제한적으로 활용한다.","",""
"[9국04-02]","단어의 짜임을 분석하여 새말 형성의 원리를 이해한다.","문법","중학교","","","","단어의 짜임을 탐구하여 새말이 형성되는 다양한 원리를 종합적으로 이해할 수 있다.","단어의 짜임을 분석하여 새말이 형성되는 다양한 원리를 이해할 수 있다.","단어의 짜임을 이해하여 새말이 형성되는 원리를 이해할 수 있다.","단어의 짜임을 일부 이해하여 새말이 형성되는 원리를 부분적으로 이해할 수 있다.","단어의 짜임을 확인하여 새말이 형성되는 원리를 제한적으로 이해한다.","",""
"[9국04-03]","품사의 종류와 특성을 이해하고 국어 자료를 분석한다.","문법","중학교","","","","품사의 종류와 특성을 탐구하고 품사 지식을 활용하여 다양한 국어 자료를 체계적이며 적절하게 분석할 수 있다.","품사의 종류와 특성을 분석하고 품사 지식을 활용하여 다양한 국어 자료를 적절하게 분석할 수 있다.","품사의 종류와 특성을 이해하고 품사 지식을 활용하여 국어 자료를 분석할 수 있다.","품사의 종류와 특성을 일부 이해하고 품사 지식을 활용하여 국어 자료를 부분적으로 분석할 수 있다.","품사의 종류와 특성을 확인하고 품사 지식을 활용하여 국어 자료를 제한적으로 분석한다.","",""
"[9국04-04]","문장의 짜임을 이해하고 표현 효과를 고려하여 문장을 구성한다.","문법","중학교","","","","문장의 짜임을 탐구하고 국어생활에서 문장의 짜임에 따른 표현 효과를 고려하여 적절한 문장을 다양하게 구성할 수 있다.","문장의 짜임을 분석하고 국어생활에서 문장의 짜임에 따른 표현 효과를 고려하여 적절한 문장을 구성할 수 있다.","문장의 짜임을 이해하고 문장의 짜임에 따른 표현 효과를 고려하여 문장을 구성할 수 있다.","문장의 짜임을 일부 이해하고 문장의 짜임에 따른 표현 효과를 부분적으로 고려하여 문장을 구성할 수 있다.","문장의 짜임을 확인하고 문장의 짜임에 따른 표현 효과를 제한적으로 고려하여 문장을 구성한다.","",""
"[9국04-05]","피동 표현과 인용 표현의 의도와 효과를 분석하고 상황에 맞게 활용한다.","문법","중학교","","","","피동 표현과 인용 표현의 의도와 효과를 탐구하고 적절한 피동 표현과 인용 표현을 다양한 상황에 따라 효과적으로 활용할 수 있다.","피동 표현과 인용 표현의 의도와 효과를 분석하고 피동 표현과 인용 표현을 상황에 따라 적절하게 활용할 수 있다.","피동 표현과 인용 표현의 의도와 효과를 이해하고 피동 표현과 인용 표현을 상황에 따라 활용할 수 있다.","피동 표현과 인용 표현의 의도와 효과를 일부 이해하고 피동 표현과 인용 표현을 상황에 따라 부분적으로 활용할 수 있다.","피동 표현과 인용 표현의 의도와 효과를 확인하고 피동 표현과 인용 표현을 상황에 따라 제한적으로 활용한다.","",""
"[9국04-06]","한글 맞춤법의 기본 원리와 내용을 이해하고 국어생활에 적용한다.","문법","중학교","","","","한글 맞춤법의 기본 원리와 내용을 탐구하고 국어생활의 문제 해결에 효과적이며 정확하게 적용할 수 있다.","한글 맞춤법의 기본 원리와 내용을 분석하고 국어생활의 문제 해결에 정확하게 적용할 수 있다.","한글 맞춤법의 기본 원리와 내용을 이해하고 국어생활의 문제 해결에 적용할 수 있다.","한글 맞춤법의 기본 원리와 내용을 일부 이해하고 국어생활의 문제 해결에 부분적으로 적용할 수 있다.","한글 맞춤법의 기본 원리와 내용을 확인하고 국어생활의 문제 해결에 제한적으로 적용한다.","",""
"[9국04-07]","세대 ·분야 ·매체에 따른 어휘의 양상과 쓰임을 분석하고 다양한 집단과 사회의 언어에 관용적 태도를 지닌다.","문법","중학교","","","","세대·분야·매체에 따른 어휘의 양상과 쓰임을 탐구하고 다양한 집단과 사회의 언어에 대한 관용적 태도를 내면화한다.","","세대·분야·매체에 따른 어휘의 양상과 쓰임을 이해하고 다양한 집단과 사회의 언어에 대해 관용적 태도를 지닌다.","","세대·분야·매체에 따른 어휘의 양상과 쓰임을 확인하고 다양한 집단과 사회의 언어에 관심을 가진다.","",""
"[9국04-08]","자신과 주변의 다양한 국어 실천 양상을 비판적으로 분석하여 언어와 자아 및 세계 사이의 관계를 인식한다.","문법","중학교","","","","자신과 주변의 다양한 국어 실천 양상을 탐구하고 평가하여 언어와 자아 및 세계 사이의 관계를 내면화한다.","","자신과 주변의 국어 실천 양상을 분석하여 언어와 자아 및 세계 사이의 관계를 인식한다.","","자신과 주변의 국어 실천 양상을 확인하고 언어와 자아 및 세계 사이의 관계에 관심을 가진다.","",""
"[9국05-01]","운율, 비유, 상징의 특성과 효과에 유의하며 작품을 감상하고 창작한다.","문학","중학교","","","","운율, 비유, 상징의 특성과 효과에 유의하며 작품을 주체적으로 감상하고, 이를 활용하여 작품을 창의적으로 창작할 수 있다.","운율, 비유, 상징의 특성과 효과에 유의하며 작품을 감상하고, 이를 활용하여 작품을 창작할 수 있다.","운율, 비유, 상징의 특성과 효과에 유의하며 작품을 감상하고, 이를 활용하여 자신의 생각이나 느낌을 표현할 수 있다.","운율, 비유, 상징의 특성에 유의하며 작품을 감상할 수 있다.","운율, 비유, 상징에 대한 부분적 이해를 바탕으로 작품을 감상한다.","",""
"[9국05-02]","갈등의 진행과 해결 과정을 파악하며 작품을 감상한다.","문학","중학교","","","","갈등의 진행과 해결 과정을 종합적으로 고려하며 작품을 감상할 수 있다.","갈등의 진행 과정을 파악하고 해결 과정에 유의하며 작품을 감상할 수 있다.","갈등의 진행 과정을 파악하며 작품을 감상할 수 있다.","갈등의 원인이나 결과를 파악하며 작품을 감상할 수 있다.","갈등에 대한 부분적 이해를 바탕으로 작품을 감상한다.","",""
"[9국05-03]","인간의 성장을 다룬 작품을 읽으며 문학의 가치를 내면화한다.","문학","중학교","","","","인간의 성장을 다룬 작품을 읽으며 문학이 지닌 가치를 내면화할 수 있다.","인간의 성장을 다룬 작품을 읽으며 자신의 삶을 성찰할 수 있다.","인간의 성장을 다룬 작품을 읽으며 인물과 자신의 삶을 연결지어 이해할 수 있다.","인간의 성장을 다룬 작품을 읽으며 인물의 성장을 전체적으로 파악할 수 있다.","인간의 성장을 다룬 작품을 읽으며 인물의 변화를 부분적으로 파악한다.","",""
"[9국05-04]","보는 이나 말하는 이의 특성과 효과를 파악하며 작품을 감상한다.","문학","중학교","","","","보는 이나 말하는 이의 특성을 파악하고 이러한 특성이 작품에 미치는 효과를 종합적으로 고려하며 작품을 감상할 수 있다.","보는 이나 말하는 이의 특성을 파악하고 이러한 특성이 작품에 미치는 효과를 부분적으로 고려하며 작품을 감상할 수 있다.","보는 이나 말하는 이의 특성을 파악하며 작품을 감상할 수 있다.","보는 이나 말하는 이의 특성을 부분적으로 파악하며 작품을 감상할 수 있다.","보는 이나 말하는 이의 존재를 파악하며 작품을 감상한다.","",""
"[9국05-05]","작품에 반영된 사회·문화적 상황을 이해하며 작품을 감상한다.","문학","중학교","","","","작품에 반영된 사회·문화적 상황을 파악하며 작품의 주제를 이해하고 자신의 상황에 비추어 감상한다.","작품에 반영된 사회·문화적 상황을 파악하고 이를 고려하여 작품의 주제를 이해할 수 있다.","작품에 반영된 사회·문화적 상황을 파악하고 이를 고려하여 인물의 말이나 행동, 사건의 의미를 이해할 수 있다.","작품에 반영된 사회·문화적 상황을 부분적으로 파악하고 이를 고려하여 인물의 말이나 행동의 의미를 이해할 수 있다.","작품에 반영된 사회·문화적 상황을 부분적으로 파악한다.","",""
"[9국05-06]","자신의 경험을 개성적인 발상과 표현으로 형상화한다.","문학","중학교","","","","반어, 역설, 풍자 등의 특성과 효과에 유의하며 자신의 경험을 창의적이고 개성적으로 표현할 수 있다.","","반어, 역설, 풍자 등의 방식을 활용하여 자신의 경험을 개성적으로 표현할 수 있다.","","자신의 생각과 느낌을 반어, 역설, 풍자 등의 방식으로 표현한다.","",""
"[6국05-07]","연관성이 있는 다른 작품들과의 관계를 파악하며 작품을 감상한다.","문학","초5-6","","","","유사한 주제나 형식을 가졌거나 서로 영향을 주고받은 작품들을 읽고 작품 간 공통점과 차이점, 연관 관계를 다각도로 파악하며 작품을 주체적으로 감상할 수 있다.","유사한 주제나 형식을 가졌거나 서로 영향을 주고받은 작품들을 읽고 작품 간 공통점과 차이점, 연관 관계를 파악하며 작품을 감상할 수 있다.","유사한 주제나 형식을 가졌거나 서로 영향을 주고받은 작품들을 읽고 작품 간 공통점과 차이점을 파악하며 작품을 감상할 수 있다.","유사한 주제나 형식을 가진 다른 작품을 읽으며 공통점과 차이점을 파악할 수 있다.","유사한 주제나 형식을 가진 다른 작품을 읽으며 공통점을 파악한다.","",""
"[9국05-08]","근거를 바탕으로 작품을 해석하고, 다른 해석들과 비교하여 자신의 해석을 평가한다.","문학","중학교","","","","근거를 바탕으로 작품을 해석하고 다른 해석들과 비판적으로 비교하면서 자신의 해석을 평가하고 보완할 수 있다.","근거를 바탕으로 작품을 해석하고 다른 해석들과 비교하면서 자신의 해석을 평가할 수 있다.","근거를 바탕으로 작품을 해석하고, 자신의 해석과 다른 해석의 공통점과 차이점을 파악할 수 있다.","근거를 바탕으로 작품을 해석하고, 다른 해석을 찾아보며 작품 해석의 다양성을 이해할 수 있다.","근거를 바탕으로 작품을 해석한다.","",""
"[9국05-09]","문학을 통해 타자를 이해하고 공동체의 문제에 참여하는 태도를 지닌다.","문학","중학교","","","","문학을 통해 타자의 상황과 관점을 이해하고 공감하며, 공동체의 문제에 주체적으로 참여하는 태도를 지닌다.","","문학을 통해 타자의 상황과 관점을 이해하고, 공동체의 문제에 참여하는 태도를 지닌다.","","문학을 통해 타자의 상황을 이해하고 공동체의 현안을 인식하는 태도를 지닌다.","",""
"[9국06-01]","대중매체와 개인 인터넷 방송의 특성과 영향력을 비교한다.","매체","중학교","","","","대중매체와 개인 인터넷 방송의 특성, 영향력, 바람직한 이용 방법을 다양한 측면에서 비교하여 설명할 수 있다.","","대중매체와 개인 인터넷 방송의 특성과 영향력을 비교하여 설명할 수 있다.","","대중매체와 개인 인터넷 방송의 특성과 영향력이 다름을 제한적으로 설명한다.","",""
"[9국06-02]","소통 맥락과 수용자 참여 양상을 고려하여 상호 작용적 매체를 분석한다.","매체","중학교","","","","소통 맥락과 수용자 참여 양상에 따라 달라지는 상호 작용적 매체의 특성과 소통 방식을 다각도로 분석하고 자신의 매체 활용 소통 행위를 점검 및 조정할 수 있다.","소통 맥락과 수용자 참여 양상에 따라 달라지는 상호 작용적 매체의 특성과 소통 방식을 분석하고 자신의 매체 활용 소통 행위를 점검할 수 있다.","소통 맥락과 수용자 참여 양상에 따라 달라지는 상호 작용적 매체의 특성과 소통 방식을 분석할 수 있다.","소통 맥락과 수용자 참여 양상에 따라 달라지는 상호 작용적 매체의 특성과 소통 방식을 부분적으로 분석할 수 있다.","소통 맥락과 수용자 참여 양상에 따라 달라지는 상호 작용적 매체의 특성과 소통 방식을 제한적으로 분석한다.","",""
"[9국06-03]","복합양식성을 고려하여 영상 매체 자료를 제작하고 공유한다.","매체","중학교","","","","복합양식적 요소를 효과적으로 활용하여 주제와 의도가 잘 드러나는 영상 매체 자료를 능동적으로 제작하고 공유할 수 있다.","복합양식적 요소를 활용하여 주제가 잘 드러나는 영상 매체 자료를 제작하고 공유할 수 있다.","복합양식적 요소를 활용하여 영상 매체 자료를 제작하고 공유할 수 있다.","복합양식적 요소를 부분적으로 활용하여 영상 매체 자료를 제작하고 공유할 수 있다.","복합양식성을 제한적으로 고려하여 영상 매체 자료를 제작한다.","",""
"[9국06-04]","매체 소통에서의 권리와 책임을 이해하고, 수용자의 반응을 고려하며 매체 자료의 제작 과정을 성찰한다.","매체","중학교","","","","매체 소통에서의 권리와 책임을 종합적으로 이해하고 수용자의 반응을 고려하며 매체 자료의 제작 과정을 다양한 관점에서 성찰할 수 있다.","","매체 소통에서 권리와 책임을 부분적으로 이해하고 수용자의 반응을 고려하며 매체 자료의 제작 과정을 성찰할 수 있다.","","매체 소통에서의 권리와 책임을 제한적으로 이해하고 매체 자료의 제작 과정의 일부를 성찰한다.","",""
"[9국06-05]","매체 자료의 재현 방식을 이해하고 광고나 홍보물을 분석한다.","매체","중학교","","","","매체 자료의 재현 방식을 종합적으로 이해하고 다양한 광고나 홍보물의 관점과 의도를 비판적으로 분석할 수 있다.","매체 자료의 재현 방식을 이해하고 광고나 홍보물의 관점과 의도를 분석할 수 있다.","매체 자료의 재현 방식을 이해하고 광고나 홍보물의 관점과 의도를 분석할 수 있다.","매체 자료의 재현 방식을 부분적으로 이해하고 광고나 홍보물의 관점과 의도를 일부 분석할 수 있다.","매체 자료의 재현 방식을 제한적으로 이해하고 광고나 홍보물의 관점과 의도를 일부 분석한다.","",""
"[9국06-06]","사회 문화적 맥락을 고려하여 매체 자료의 공정성을 평가한다.","매체","중학교","","","","매체 자료가 생산된 사회 문화적 맥락을 종합적으로 고려하여 다양한 매체 자료의 공정성을 다양한 관점에서 평가할 수 있다.","","매체 자료가 생산된 사회 문화적 맥락을 고려하여 매체 자료의 공정성을 부분적으로 평가할 수 있다.","","매체 자료가 생산된 사회 문화적 맥락을 일부 고려하여 매체 자료의 공정성을 제한적으로 평가한다.","",""
