"code","description","domain","grade","keywords","prerequisite","scope","level_A","level_B","level_C","level_D","level_E","competencies","common_misconceptions"
"[9국01-01]","화자의 의도와 관점을 추론하며 듣는다.","듣기·말하기","중학교","","","","다양한 담화 맥락과 정보를 활용하여 화자의 의도와 관점을 정확하게 추론하며 들을 수 있다.","담화 맥락과 정보를 활용하여 화자의 의도와 관점을 추론하며 들을 수 있다.","담화 맥락을 활용하여 화자의 의도와 관점을 추론하며 들을 수 있다.","담화 맥락을 일부 활용하여 화자의 의도와 관점을 부분적으로 추론하며 들을 수 있다.","화자의 의도와 관점을 부분적으로 추론하며 듣는다.","",""
"[9국01-02]","설득 전략을 비판적으로 분석하며 듣는다.","듣기·말하기","중학교","","","","담화의 목적과 상대의 입장을 고려하여 설득 전략의 효과를 분석하고 다양한 관점에서 타당한 근거를 들어 적극적으로 평가할 수 있다.","담화의 목적을 고려하여 설득 전략의 효과를 분석하고 다양한 관점에서 타당한 근거를 들어 평가할 수 있다.","설득 전략의 효과를 타당한 근거를 들어 평가할 수 있다.","설득 전략의 일부를 파악하고 설득 전략의 효과를 부분적으로 평가할 수 있다.","설득 전략을 부분적으로 파악하며 듣는다.","",""
"[9국01-03]","담화 공동체에 따른 듣기･말하기 방식의 다양성을 고려하여 듣고 말한다.","듣기·말하기","중학교","","","","담화 공동체에 따른 듣기･말하기 방식의 다양성을 존중하여 사회·문화적 맥락에 맞게 적절한 방식으로 듣고 말할 수 있다.","담화 공동체에 따른 듣기･말하기 방식의 다양성을 고려하며 적절한 방식으로 듣고 말할 수 있다.","담화 공동체에 따른 듣기･말하기 방식의 다양성을 이해하며 듣고 말할 수 있다.","담화 공동체에 따른 듣기･말하기 방식을 부분적으로 이해하며 듣고 말할 수 있다.","담화 공동체에 따른 듣기·말하기의 방식을 제한적으로 이해한다.","",""
"[9국01-04]","상대의 말을 경청하고 상대의 감정과 입장에 공감하는 반응을 보이며 대화한다.","듣기·말하기","중학교","","","","상대의 말을 경청하며 상대의 감정과 입장에 공감하고, 그에 따라 적절한 반응을 지속적으로 보이며 대화를 나눌 수 있다.","","상대의 말을 경청하고 상대의 감정과 입장에 공감하는 반응을 보이며 대화를 나눌 수 있다.","","상대의 말을 듣고 감정을 파악하며 대화를 나눈다.","",""
"[9국01-05]","면담의 다양한 목적과 상대를 고려하여 질문을 점검하고 효과적으로 면담한다.","듣기·말하기","중학교","","","","면담의 다양한 목적과 상대를 고려하여 적합한 질문을 체계적으로 준비하고, 면담 상황에 따라 질문을 점검하고 조정하며 효과적으로 면담할 수 있다.","면담의 다양한 목적과 상대를 고려하여 질문을 준비하고, 면담 상황에 따라 질문을 점검하여 효과적으로 면담할 수 있다.","면담의 목적과 상대를 고려하여 질문을 준비하고, 면담 상황에 따라 질문을 점검하여 면담할 수 있다.","면담 질문을 준비하고, 면담 상황에 따라 부분적으로 질문을 점검하여 면담할 수 있다.","면담 질문을 준비하고, 면담 상황에 따라 질문하며 면담한다.","",""
"[9국01-06]","다양한 자료를 재구성하여 내용을 체계적으로 조직하고 청중이 이해하기 쉽게 발표한다.","듣기·말하기","중학교","","","","청중의 관심과 요구를 고려하여 다양한 자료를 재구성하고 내용을 체계적으로 조직하여 청중이 이해하기 쉽도록 중요한 내용을 강조하여 발표할 수 있다.","다양한 자료를 재구성하여 내용을 조직하고 청중이 이해하기 쉽도록 중요한 내용을 강조하여 발표할 수 있다.","다양한 자료를 활용하여 내용을 조직하고 청중이 이해할 수 있도록 발표할 수 있다.","자료를 활용하여 내용을 조직하고 청중을 고려하여 발표할 수 있다.","자료를 바탕으로 내용을 구성하여 발표한다.","",""
"[9국01-07]","토의에서 다양한 의견을 교환하여 대안을 마련하고 문제를 해결한다.","듣기·말하기","중학교","","","","토의에서 쟁점을 파악하고 각 대안의 장단점에 대해 다양한 의견을 적극적으로 교환하여 적절한 대안을 마련하고 합리적으로 문제를 해결할 수 있다.","토의에서 쟁점을 파악하고 각 대안에 대해 의견을 교환하여 적절한 대안을 마련하고 문제를 해결할 수 있다.","토의에서 다양한 의견을 교환하여 대안을 마련할 수 있다.","토의에서 의견을 부분적으로 교환하여 대안을 마련할 수 있다.","토의에서 자신의 의견을 제시하며 의견 교환에 참여한다.","",""
"[9국01-08]","토론에서 반론을 고려하여 타당한 논증을 구성하고 논리적으로 반박한다.","듣기·말하기","중학교","","","","토론에서 반론을 고려하여 타당한 논증을 구성하고, 다양한 관점에서 상대의 논증 구성 요소의 논리적 허점이나 오류에 대해 근거를 들어 논리적으로 반박할 수 있다.","토론에서 반론을 고려하여 타당한 논증을 구성하고, 다양한 관점에서 상대의 논증 구성 요소의 타당성에 대해 논리적으로 반박할 수 있다.","토론에서 반론을 고려하여 타당한 논증을 구성하고, 상대의 논증 구성 요소의 타당성에 대해 반박할 수 있다.","토론에서 자신의 주장과 근거를 고려하여 논증을 구성하고, 상대의 주장과 근거에 대한 의견을 제시할 수 있다.","토론에서 자신의 주장과 근거를 고려하여 부분적으로 논증을 구성한다.","",""
"[9국01-09]","서로의 감정이나 바라는 바를 진솔하게 표현하면서 갈등을 조정한다.","듣기·말하기","중학교","","","","갈등 상황을 명확히 파악하고 상호 존중하는 태도로 서로의 감정이나 바라는 바를 진솔하게 표현하면서 협력적으로 갈등을 조정할 수 있다.","갈등 상황을 파악하고 서로의 감정이나 바라는 바를 진솔하게 표현하면서 협력적으로 갈등을 조정할 수 있다.","갈등 상황에서 서로의 감정이나 바라는 바를 진솔하게 표현하면서 갈등을 조정할 수 있다.","갈등 상황에서 서로의 감정이나 바라는 바를 표현하며 부분적으로 갈등을 조정할 수 있다.","갈등 상황에서 서로의 감정이나 바라는 바를 부분적으로 표현한다.","",""
"[9국01-10]","언어폭력의 문제점을 성찰하고, 서로를 존중하는 표현을 사용하여 말한다.","듣기·말하기","중학교","","","","언어폭력의 문제점을 여러 측면에서 이해하고 자신의 언어 습관을 성찰하여 서로를 존중하는 말하기를 다양한 표현을 사용하여 지속적이고 능동적으로 실천할 수 있다.","","언어폭력의 문제점을 이해하고 자신의 언어 습관을 성찰하여 서로를 존중하는 표현을 사용하여 말할 수 있다.","","언어폭력의 문제점을 알고 서로를 존중하는 표현을 부분적으로 사용하여 말한다.","",""
"[9국01-11]","듣기･말하기 과정을 점검하고 듣기･말하기의 어려움을 효과적으로 조정한다.","듣기·말하기","중학교","","","","듣기·말하기 방식과 과정을 지속적으로 점검하고 개선하며, 듣기·말하기 과정에서 발생하는 다양한 어려움을 효과적으로 조정할 수 있다.","듣기·말하기 방식과 과정을 점검하고, 듣기·말하기 과정에서 발생하는 어려움을 효과적으로 조정할 수 있다.","듣기·말하기 과정을 점검하고, 듣기·말하기 과정에서 발생하는 어려움을 조정할 수 있다.","듣기·말하기 과정을 점검하고 듣기·말하기의 어려움을 파악할 수 있다.","듣기·말하기 과정을 부분적으로 점검한다.","",""
"[9국02-01]","읽기는 사회· 문화적 맥락에서 의미를 구성하는 과정임을 이해하며 사회적 독서에 참여하고 사회적 독서 문화 형성에 기여한다.","읽기","중학교","","","","읽기가 사회･문화적 맥락에서 의미를 구성하는 과정임을 이해하고, 협력적으로 의미 구성하여 사회적 독서에 적극적으로 참여하며 사회적 독서 문화 형성에 기여할 수 있다.","","읽기가 사회･문화적 맥락에서 의미를 구성하는 과정임을 이해하고, 사회적 독서에 참여하며 사회적 독서 문화 형성에 기여할 수 있다.","","읽기가 사회･문화적 맥락에서 의미를 구성하는 과정임을 부분적으로 이해하고, 사회적 독서 활동에 제한적으로 참여한다.","",""
"[9국02-02]","읽기 목적과 글의 구조를 고려하며 글을 효과적으로 요약한다.","읽기","중학교","","","","요약하기 원리와 방법에 대한 이해를 바탕으로, 글의 구조를 고려하며 읽기 목적에 맞게 중심 내용을 파악하고 효과적으로 요약할 수 있다.","요약하기 원리와 방법에 대한 이해를 바탕으로 글의 구조를 고려하며 읽기 목적에 맞게 중심 내용을 파악하고 요약할 수 있다.","글의 구조를 고려하며 읽기 목적에 맞게 중심 내용을 파악하고 요약할 수 있다","글의 구조와 읽기 목적을 부분적으로 고려하며 글을 요약할 수 있다.","글의 구조를 부분적으로 고려하며 글을 요약한다.","",""
"[9국02-03]","독자의 배경지식과 글에 나타난 정보 등을 활용하여 글에 드러나지 않은 의도나 관점을 추론하며 읽는다.","읽기","중학교","","","","독자의 배경지식과 글의 문맥이나 정보 등을 적극적으로 활용하여 글에 드러나지 않은 필자의 의도나 관점을 적절하게 추론하며 읽을 수 있다.","독자의 배경지식과 글의 문맥이나 정보 등을 활용하여 글에 드러나지 않은 필자의 의도나 관점을 추론하며 읽을 수 있다.","독자의 배경지식과 글에 나타난 정보 등을 활용하여 글에 드러나지 않은 내용을 추론하며 읽을 수 있다.","독자의 배경지식이나 글에 나타난 정보를 활용하여 글에 드러나지 않은 내용을 부분적으로 추론하며 읽을 수 있다.","독자의 배경지식이나 글에 나타난 단서 정보를 제한적으로 활용하며 글에 드러나지 않은 내용은 부분적으로 추론하며 읽는다.","",""
"[9국02-04]","복합양식으로 구성된 글이나 자료의 내용 타당성과 신뢰성, 표현 방법의 적절성을 평가하며 읽는다.","읽기","중학교","","","","복합양식의 글이나 자료를 읽을 때, 작성 맥락을 고려하여 내용 타당성과 신뢰성을 평가할 수 있고, 복합양식적 특성과 전달 효과를 고려하여 표현 방법의 적절성을 평가할 수 있다.","복합양식의 글이나 자료를 읽을 때, 내용 타당성과 신뢰성을 평가할 수 있고, 복합양식적 특성이나 전달 효과를 고려하여 표현 방법의 적절성을 평가할 수 있다.","복합양식의 글이나 자료를 읽을 때, 내용 타당성과 신뢰성, 표현 방법의 적절성을 평가할 수 있다.","복합양식의 글이나 자료를 읽을 때, 내용 타당성과 신뢰성, 표현 방법의 적절성을 부분적으로 평가할 수 있다.","복합양식의 글이나 자료를 읽을 때, 내용이나 표현 방법을 제한적으로 평가한다.","",""
"[9국02-05]","글에 사용된 다양한 설명 방법과 논증 방법을 파악하고, 그 타당성을 평가하며 읽는다.","읽기","중학교","","","","설명 방법과 논증 방법의 개념에 대해 이해하고, 글에 사용된 다양한 설명 방법과 논증 방법을 파악하여 그 타당성을 적절하게 평가할 수 있다.","설명 방법과 논증 방법의 개념에 대해 이해하고, 글에 사용된 다양한 설명 방법과 논증 방법을 파악하여 그 타당성을 평가할 수 있다.","설명 방법과 논증 방법의 개념에 대해 이해하고, 글에 사용된 설명 방법과 논증 방법을 파악하여 그 타당성을 평가할 수 있다.","설명 방법과 논증 방법의 개념에 대해 부분적으로 이해하고, 글에 사용된 설명 방법과 논증 방법을 부분적으로 파악하여 그 타당성을 부분적으로 평가할 수 있다.","설명 방법과 논증 방법의 개념에 대해 제한적으로 이해하고, 글에 사용된 다양한 설명 방법이나 논증 방법을 제한적으로 파악한다.","",""
"[9국02-06]","동일한 화제를 다룬 여러 글이나 자료를 주제 통합적으로 읽는다.","읽기","중학교","","","","동일한 화제를 다룬 여러 글이나 자료를 읽을 때, 형식과 내용의 측면에서 비교 분석하여 비판적으로 읽고 화제에 대한 자신의 관점을 세우고 창의적으로 재구성할 수 있다.","동일한 화제를 다룬 여러 글이나 자료를 읽을 때, 형식과 내용의 측면에서 비교 분석하여 읽고 화제에 대한 자신의 관점을 세우고 재구성할 수 있다.","동일한 화제를 다룬 여러 글이나 자료를 읽을 때, 형식과 내용의 측면에서 비교 분석하여 읽고 화제에 대한 자신의 관점을 세울 수 있다.","동일한 화제를 다룬 여러 글이나 자료를 읽을 때, 형식이나 내용의 측면에서 비교 분석할 수 있다.","동일한 화제를 다룬 여러 글이나 자료를 읽을 때, 형식이나 내용의 측면 중 일부를 비교 분석한다.","",""
"[9국02-07]","진로나 관심 분야에 대한 다양한 책이나 자료를 스스로 찾아 읽는다.","읽기","중학교","","","","진로나 관심 분야에 대한 책이나 자료 등을 스스로 찾으며 진로나 관심 분야에 관한 유의미한 정보를 탐색하고 이를 공유하며 독서 활동에 적극적으로 참여할 수 있다.","","진로나 관심 분야에 대한 책이나 자료 등을 스스로 찾으며 진로나 관심 분야에 관한 독서 활동에 참여할 수 있다.","","교사가 안내한 진로나 관심 분야에 대한 책이나 자료를 바탕으로 진로나 관심 분야에 관한 독서 활동에 참여한다.","",""
"[9국02-08]","자신의 독서 상황과 수준에 맞는 글을 선정하고 읽기 과정을 점검·조정하며 읽는다.","읽기","중학교","","","","독서 상황과 수준에 맞는 글을 적절하게 선정하고, 책 선정 전략과 읽기 과정을 효과적으로 점검･조정하며 자기 선택적 독서 활동에 적극적으로 참여할 수 있다.","독서 상황과 수준에 맞는 글을 적절하게 선정하고, 책 선정 전략과 읽기 과정을 점검･조정하며 자기 선택적 독서 활동에 참여할 수 있다.","독서 상황과 수준에 맞는 글을 선정하고, 책 선정 전략과 읽기 과정을 점검･조정하며 자기 선택적 독서에 참여할 수 있다.","독서 상황과 수준을 고려하여 글을 선정하고, 책 선정 전략과 읽기 과정을 부분적으로 점검･조정하며 자기 선택적 독서에 참여할 수 있다.","독서 상황과 수준을 제한적으로 고려하여 글을 선정하고, 책 선정 전략과 읽기 과정을 제한적으로 점검･조정하며 자기 선택적 독서에 참여한다.","",""
"[9국03-01]","대상의 특성에 적합한 설명 방법을 활용하여 글을 쓴다.","쓰기","중학교","","","","설명 대상의 특성을 나타내는 데 적합한 설명 방법을 선택하고 이를 다양하게 활용하여 대상의 특성이 효과적으로 드러나는 글을 쓸 수 있다.","설명 대상의 특성을 나타내는 데 적합한 설명 방법을 선택하고 이를 활용하여 대상의 특성이 드러나는 글을 쓸 수 있다.","설명 대상의 특성을 고려하여 설명 방법을 선택하고 이를 활용하여 대상의 특성이 드러나는 글을 쓸 수 있다.","설명 대상의 특성을 고려하여 설명 방법을 선택하고 이를 활용하여 대상의 특성이 부분적으로 드러나는 글을 쓸 수 있다.","설명 대상의 특성이 제한적으로 드러나는 설명 방법을 활용하여 글을 쓴다.","",""
"[9국03-02]","복수의 자료를 활용하여 다양한 형식으로 정보를 전달하는 글을 쓴다.","쓰기","중학교","","","","다양한 매체에서 수집한 복수의 자료를 적절하게 활용하고 문자 언어, 도표, 그림 등을 효과적으로 결합하여 다양한 형식으로 정보를 전달하는 글을 쓸 수 있다.","다양한 매체에서 수집한 복수의 자료를 활용하고 문자 언어, 도표, 그림 등을 적절히 결합하여 다양한 형식으로 정보를 전달하는 글을 쓸 수 있다.","복수의 자료를 활용하여 문자 언어, 도표, 그림 등을 결합한 다양한 형식으로 정보를 전달하는 글을 쓸 수 있다.","자료를 활용하여 문자 언어, 도표, 그림 등을 결합한 형식으로 정보를 전달하는 글을 쓸 수 있다.","자료를 활용하여 제한된 형식으로 정보를 전달하는 글을 쓴다.","",""
"[9국03-03]","주장을 뒷받침할 수 있는 타당한 근거를 들고 적절한 표현을 사용하여 주장하는 글을 쓴다.","쓰기","중학교","","","","주장을 뒷받침할 수 있는 타당하고 다양한 근거를 들고 적절하고 효과적인 표현을 사용하여 자신의 주장을 설득력 있게 제시하는 주장하는 글을 쓸 수 있다.","주장을 뒷받침할 수 있는 타당한 근거를 들고 적절한 표현을 사용하여 자신의 주장을 설득력 있게 제시하는 주장하는 글을 쓸 수 있다.","주장을 뒷받침할 수 있는 타당한 근거를 들고 적절한 표현을 사용하여 자신의 주장을 제시하는 글을 쓸 수 있다.","주장을 뒷받침할 수 있는 근거를 들고 적절한 표현을 부분적으로 사용하여 주장하는 글을 쓸 수 있다.","주장을 뒷받침할 수 있는 근거를 제한적으로 들어 주장하는 글을 쓴다.","",""
"[9국03-04]","의견 차이가 있는 사안에 대해 자료를 수집하고 사회·문화적 맥락을 고려하며 주장하는 글을 쓴다.","쓰기","중학교","","","","의견 차이가 있는 사안의 쟁점에 대한 다양한 자료를 수집하고 이에 대한 자신의 주장이 사회･문화적 맥락 안에서 수용될 수 있도록 주장을 논리적으로 전개한 글을 쓸 수 있다.","의견 차이가 있는 사안의 쟁점에 대한 다양한 자료를 수집하고 이에 대한 자신의 주장이 사회･문화적 맥락 안에서 수용될 수 있는지 고려하며 주장하는 글을 쓸 수 있다.","의견 차이가 있는 사안에 대한 자료를 수집하고 이에 대한 자신의 주장이 사회･문화적 맥락 안에서 수용될 수 있는지 고려하며 주장하는 글을 쓸 수 있다.","의견 차이가 있는 사안에 대한 일부 자료를 수집하고 이에 대한 자신의 주장이 사회･문화적 맥락 안에서 수용될 수 있는지 부분적으로 고려하며 주장하는 글을 쓸 수 있다.","의견 차이가 있는 사안에 대한 일부 자료를 제한적으로 수집하고 이에 대한 자신의 주장이 사회･문화적 맥락 안에서 수용될 수 있는지 제한적으로 고려하며 주장하는 글을 쓴다.","",""
"[9국03-05]","자신의 삶과 경험을 바탕으로 정서를 진솔하게 표현하는 글을 쓴다.","쓰기","중학교","","","","자신의 삶과 경험을 진지하게 되돌아보며 의미 있는 장면을 선정하고 이에 대한 정서를 진솔하고 개성 있게 표현하는 글을 쓸 수 있다.","자신의 삶과 경험을 되돌아보며 의미 있는 장면을 선정하고 이에 대한 정서를 진솔하게 표현하는 글을 쓸 수 있다.","자신의 삶과 경험을 되돌아보며 이에 대한 정서를 진솔하게 표현하는 글을 쓸 수 있다.","자신의 삶이나 경험을 부분적으로 반영하여 정서를 표현하는 글을 쓸 수 있다.","자신의 삶이나 경험과 관련한 정서를 제한적으로 표현하는 글을 쓴다.","",""
"[9국03-06]","다양한 표현을 활용하여 자신의 생각과 느낌이 드러나는 글을 쓰고 독자와 공유한다.","쓰기","중학교","","","","다양하고 참신한 표현을 활용하여 자신의 생각과 느낌이 효과적으로 드러나는 글을 쓰고, 자신이 쓴 글을 다양한 방식으로 독자와 적극적이고 개방적으로 공유할 수 있다.","다양한 표현을 활용하여 자신의 생각과 느낌이 효과적으로 드러나는 글을 쓰고, 자신이 쓴 글을 다양한 방식으로 독자와 적극적으로 공유할 수 있다.","다양한 표현을 활용하여 자신의 생각과 느낌이 드러나는 글을 쓰고, 자신이 쓴 글을 다양한 방식으로 독자와 공유할 수 있다.","일부 표현을 활용하여 자신의 생각이나 느낌이 부분적으로 드러나는 글을 쓰고, 자신이 쓴 글을 독자와 공유할 수 있다.","일부 표현을 활용하여 자신의 생각이나 느낌이 제한적으로 드러나는 글을 쓰고, 자신이 쓴 글을 독자와 제한적으로 공유한다.","",""
"[9국03-07]","복합양식 자료를 활용하여 내용을 생성하고 글의 유형을 고려하여 내용을 조직하며 글을 쓴다.","쓰기","중학교","","","","다양한 매체를 통해 수집한 복합양식 자료를 효과적으로 활용하여 글의 내용을 풍부하게 생성하고, 글의 목적과 유형에 적합하게 내용을 조직하며 글을 쓸 수 있다.","매체를 통해 수집한 복합양식 자료를 활용하여 글의 내용을 생성하고, 글의 목적과 유형에 적합하게 내용을 조직하며 글을 쓸 수 있다.","복합양식 자료를 활용하여 글의 내용을 생성하고, 글의 유형에 적합하게 내용을 조직하며 글을 쓸 수 있다.","복합양식 자료를 일부 활용하여 내용을 생성하고 글의 유형을 부분적으로 고려하여 내용을 조직하며 글을 쓸 수 있다.","복합양식 자료를 제한적으로 활용하여 내용을 생성하며 글을 쓴다.","",""
"[9국03-08]","쓰기 과정과 전략을 점검·조정하며 글을 쓰고, 독자를 고려하여 글을 고쳐 쓴다.","쓰기","중학교","","","","자신의 쓰기 과정과 전략을 능동적으로 점검･조정하며 글을 쓰고, 독자의 상황과 특성을 적절히 고려하여 글의 내용, 조직, 표현을 효과적으로 고쳐 쓸 수 있다.","자신의 쓰기 과정과 전략을 능동적으로 점검･조정하며 글을 쓰고, 독자의 상황과 특성을 고려하여 글의 내용, 조직, 표현을 고쳐 쓸 수 있다.","자신의 쓰기 과정과 전략을 점검･조정하며 글을 쓰고, 독자를 고려하여 글의 내용, 조직, 표현을 고쳐 쓸 수 있다.","자신의 쓰기 과정이나 전략을 부분적으로 점검하며 글을 쓰고, 독자를 고려하여 글의 내용, 조직, 표현을 일부 고쳐 쓸 수 있다.","자신의 쓰기 과정과 전략을 제한적으로 점검하며 글을 쓰고, 독자를 제한적으로 고려하여 글의 내용, 조직, 표현을 일부 고쳐 쓴다.","",""
"[9국03-09]","언어 공동체의 구성원인 필자로서 자신에 대해 성찰하며, 윤리적 소통 문화를 형성하는 데에 기여한다.","쓰기","중학교","","","","언어 공동체의 구성원인 필자로서 자신에 대해 지속적으로 성찰하고 능동적이고 책임감 있는 태도로 쓰기에 참여하며, 바람직한 윤리적 소통 문화를 형성하는 데에 기여할 수 있다.","언어 공동체의 구성원인 필자로서 자신에 대해 지속적으로 성찰하고 책임감 있는 태도로 쓰기에 참여하며, 윤리적 소통 문화를 형성하는 데에 기여할 수 있다.","언어 공동체의 구성원인 필자로서 자신에 대해 성찰하고 책임감 있는 태도로 쓰기에 참여하며, 윤리적 소통 문화를 형성하는 데에 기여할 수 있다.","필자로서 자신을 인식하고, 윤리적 소통 문화를 형성하는 데에 부분적으로 기여할 수 있다.","필자로서 자신을 제한적인 수준에서 인식하고, 윤리적 소통 문화를 형성하는 데에 제한적으로 기여한다.","",""
